{
  "walk_forward_windows": [
    {
      "fold": 1,
      "train_size": 116,
      "test_size": 116,
      "classification": {
        "accuracy": 0.5344827586206896,
        "precision": 0.7894736842105263,
        "recall": 0.23076923076923078,
        "f1": 0.35714285714285715,
        "roc_auc": 0.5337858220211161,
        "brier_score": 0.44717252844028293,
        "calibration_error": 0.4347871464320684
      }
    },
    {
      "fold": 2,
      "train_size": 232,
      "test_size": 116,
      "classification": {
        "accuracy": 0.4482758620689655,
        "precision": 0.8,
        "recall": 0.05970149253731343,
        "f1": 0.1111111111111111,
        "roc_auc": 0.6873286628084071,
        "brier_score": 0.5264210683947492,
        "calibration_error": 0.5352084322028343
      }
    },
    {
      "fold": 3,
      "train_size": 348,
      "test_size": 116,
      "classification": {
        "accuracy": 0.45689655172413796,
        "precision": 0.43564356435643564,
        "recall": 0.88,
        "f1": 0.5827814569536424,
        "roc_auc": 0.48424242424242425,
        "brier_score": 0.3926725606605104,
        "calibration_error": 0.346060085624821
      }
    },
    {
      "fold": 4,
      "train_size": 464,
      "test_size": 116,
      "classification": {
        "accuracy": 0.5086206896551724,
        "precision": 0.5192307692307693,
        "recall": 0.8852459016393442,
        "f1": 0.6545454545454545,
        "roc_auc": 0.49985096870342777,
        "brier_score": 0.3568860887471245,
        "calibration_error": 0.3109007562074584
      }
    },
    {
      "fold": 5,
      "train_size": 580,
      "test_size": 116,
      "classification": {
        "accuracy": 0.3793103448275862,
        "precision": 0.3739130434782609,
        "recall": 1.0,
        "f1": 0.5443037974683544,
        "roc_auc": 0.5046193055113093,
        "brier_score": 0.4847316289317097,
        "calibration_error": 0.4992975629464036
      }
    }
  ],
  "train_ranges": [],
  "val_ranges": [],
  "test_ranges": [],
  "sample_sizes": {
    "oof_samples": 580
  }
}